{
	"id": "five-year-plan-1974",
	"title": "Five Year Plan",
	"kind": "plan",
	"scheme": "divine-plan",
	"parentId": "divine-2",
	"temporal": {
		"type": "period",
		"start": {
			"year": 1974,
			"precision": "year"
		},
		"end": {
			"year": 1979,
			"precision": "year"
		}
	},
	"sourceIds": ["ages"],
	"summary": "A worldwide teaching plan.",
	"importance": 2,
	"laneId": "plan",
	"status": "published"
}
