{
	"id": "one-year-plan",
	"title": "One Year Plan",
	"kind": "plan",
	"scheme": "divine-plan",
	"parentId": "divine-3",
	"temporal": {
		"type": "period",
		"start": {
			"year": 2021,
			"precision": "year"
		},
		"end": {
			"year": 2022,
			"precision": "year"
		}
	},
	"sourceIds": ["nine"],
	"summary": "A bridge into the next series of global plans.",
	"importance": 2,
	"laneId": "plan",
	"status": "published"
}
