{
	"id": "three-year-plan",
	"title": "Three Year Plan",
	"kind": "plan",
	"scheme": "divine-plan",
	"parentId": "divine-2",
	"temporal": {
		"type": "period",
		"start": {
			"year": 1993,
			"precision": "year"
		},
		"end": {
			"year": 1996,
			"precision": "year"
		}
	},
	"sourceIds": ["community"],
	"summary": "A worldwide teaching plan.",
	"importance": 2,
	"laneId": "plan",
	"status": "published"
}
