{
	"id": "election-uhj",
	"title": "First election of the Universal House of Justice",
	"kind": "event",
	"scheme": "events",
	"parentId": "formative-age",
	"temporal": {
		"type": "point",
		"date": {
			"year": 1963,
			"month": 4,
			"day": 21,
			"precision": "day"
		}
	},
	"sourceIds": ["community", "uhj-constitution"],
	"summary": "The international governing institution of the Bahá’í Faith was first elected in Haifa.",
	"importance": 5,
	"laneId": "event",
	"status": "published",
	"relatedIds": ["universal-house-of-justice", "custodianship-hands"]
}
